{
  "name": "turn",
  "span_kind": "CHAIN",
  "events": [
    {
      "name": "user_feedback",
      "attributes": {
        "label": "thumbs_up",
        "comment": "clear answer"
      }
    }
  ],
  "attributes": {
    "atlas.semconv.version": "0.64b0",
    "atlas.variant": "graph",
    "atlas.config.hash": "c89d957cba46a0d2478f3124a8ddf0a9679ed9e7bc35589ec1782fd396b78bb2",
    "atlas.corpus.version": "corpus-0.1.1",
    "atlas.index.build_id": "a86bc176d5bf7d04",
    "atlas.privacy.redaction_policy_version": "726bb9ddc4b174af",
    "atlas.privacy.synthetic": true,
    "atlas.privacy.content_captured": false,
    "atlas.subject.pseudonym": "7b95a9bff030dc90",
    "atlas.contract.trace_version": "1.3.0",
    "atlas.contract.dataset_version": "0.1.0",
    "atlas.contract.manifest_version": "0.1.0",
    "atlas.contract.sse_version": "0.1.0"
  }
}
